{
    "$schema": "https://json-schema.org/draft/2019-09/schema",
    "title": "Chain",
    "type": "object",
    "required": [
        "chain_id",
        "is_testnet",
        "chain_name",
        "chain_type"
    ],
    "properties": {
        "$schema": {
            "type": "string",
            "minLength": 1,
            "pattern": "^(\\.\\./)+initia.chain\\.schema\\.json$"
        },
        "chain_id": {
            "type": "string",
            "minLength": 1,
            "pattern": "[a-z0-9-]+",
            "examples": [
                "initiation-1"
            ]
        },
        "is_testnet": {
            "type": "boolean",
            "default": false
        },
        "chain_name": {
            "type": "string",
            "minLength": 1,
            "pattern": "[a-z0-9]+",
            "examples": [
                "minimove"
            ]
        },
        "is_initia_l1": {
            "type": "boolean",
            "default": false
        },
        "initia_l1_chain_id": {
            "type": "string",
            "minLength": 1,
            "pattern": "[a-z0-9-]+",
            "description": "The chain ID of the L1 chain. Required if the chain is an L2.",
            "examples": [
                "initiation-1"
            ]
        },
        "chain_type": {
            "const": "initia"
        },
        "apis": {
            "type": "object",
            "properties": {
                "required": [
                    "cosmos_sdk_grpc_endpoint",
                    "tendermint_rpc_endpoint"
                ],
                "lcd_rest_endpoint": {
                    "$ref": "#/$defs/endpoint",
                    "description": "Only required for initia-1."
                },
                "tendermint_rpc_endpoint": {
                    "$ref": "#/$defs/endpoint"
                },
                "cosmos_sdk_grpc_endpoint": {
                    "$ref": "#/$defs/grpc_endpoint"
                }
            },
            "additionalProperties": false
        }
    },
    "anyOf": [
        {
            "properties": {
                "is_initia_l1": { "const": true }
            }
        },
        {
            "properties": {
                "is_initia_l1": { "const": false }
            },
            "required": ["initia_l1_chain_id"]
        }
    ],
    "$defs": {
        "endpoint": {
            "type": "object",
            "required": [
                "address"
            ],
            "properties": {
                "address": {
                    "type": "string",
                    "format": "uri"
                },
                "provider": {
                    "type": "string"
                },
                "archive": {
                    "type": "boolean",
                    "default": false
                },
                "backoff_delay": {
                    "type": "integer",
                    "description": "Delay in milliseconds between request retires."
                },
                "basic_auth_required": {
                    "type": "boolean",
                    "default": false,
                    "description": "If basic HTTP authentication (username + password) is required to access this endpoint."
                },
                "index_for_skip": {
                    "type": "number",
                    "description": "The index for the basic auth salt generation."
                }
            }
        },
        "grpc_endpoint": {
            "allOf": [
                {
                    "$ref": "#/$defs/endpoint"
                },
                {
                    "type": "object",
                    "properties": {
                        "tls": {
                            "type": "boolean",
                            "description": "If TLS is required to access this GRPC endpoint.",
                            "default": false
                        }
                    }
                }
            ]
        }
    }
}
