{
  "$schema": "../../initia.chain.schema.json",
  "chain_id": "inertiation-10",
  "is_testnet": true,
  "chain_name": "inertia",
  "chain_type": "initia",
  "is_initia_l1": false,
  "initia_l1_chain_id": "initiation-2",
  "apis": {
    "tendermint_rpc_endpoint": {
      "address": "https://rpc.inertia.testnet.inrt.fi",
      "backoff_delay": 1000
    },
    "lcd_rest_endpoint": {
      "address": "https://rest.inertia.testnet.inrt.fi",
      "backoff_delay": 1000
    },
    "cosmos_sdk_grpc_endpoint": {
      "address": "grpc.inertia.testnet.inrt.fi:443",
      "backoff_delay": 0,
      "tls": true
    }
  }
}
