{
    "$schema": "../../initia.chain.schema.json",
    "chain_id": "miniwasm-2",
    "is_testnet": true,
    "chain_name": "miniwasm",
    "chain_type": "initia",
    "apis": {
        "tendermint_rpc_endpoint": {
            "address": "https://rpc-skip.miniwasm-2.initia.xyz",
            "provider": "Initia Labs",
            "backoff_delay": 1000,
            "basic_auth_required": true,
            "index_for_skip": 0
        },
        "lcd_rest_endpoint": {
            "address": "https://rest-skip.miniwasm-2.initia.xyz",
            "provider": "Initia Labs",
            "backoff_delay": 1000,
            "basic_auth_required": true,
            "index_for_skip": 0
        },
        "cosmos_sdk_grpc_endpoint": {
            "address": "grpc-skip.miniwasm-2.initia.xyz:443",
            "provider": "Initia Labs",
            "backoff_delay": 0,
            "tls": true,
            "basic_auth_required": true,
            "index_for_skip": 0
        }
    }
}