{
  "$schema": "../../initia.chain.schema.json",
  "chain_id": "bfb-1",
  "is_testnet": false,
  "chain_name": "bfb",
  "chain_type": "initia",
  "is_initia_l1": false,
  "initia_l1_chain_id": "interwoven-1",
  "apis": {
    "tendermint_rpc_endpoint": {
      "address": "https://rpc-bfb-1.anvil.asia-southeast.initia.xyz",
      "backoff_delay": 1000
    },
    "lcd_rest_endpoint": {
      "address": "https://rest-bfb-1.anvil.asia-southeast.initia.xyz",
      "backoff_delay": 1000
    },
    "cosmos_sdk_grpc_endpoint": {
      "address": "grpc-bfb-1.anvil.asia-southeast.initia.xyz:443",
      "backoff_delay": 0,
      "tls": true
    }
  }
}