{
    "$schema": "../../initia.chain.schema.json",
    "chain_id": "init-ai-1",
    "is_testnet": true,
    "chain_name": "init_ai",
    "chain_type": "initia",
    "apis": {
        "tendermint_rpc_endpoint": {
            "address": "https://maze-rpc-617bacff-7d34-4eb8-87f4-ee16fb4e0ac7.ue1-prod.newmetric.xyz",
            "backoff_delay": 1000
        },
        "lcd_rest_endpoint": {
            "address": "https://maze-rest-617bacff-7d34-4eb8-87f4-ee16fb4e0ac7.ue1-prod.newmetric.xyz",
            "backoff_delay": 1000
        },
        "cosmos_sdk_grpc_endpoint": {
            "address": "54.147.50.234:31001",
            "backoff_delay": 0,
            "tls": true
        }
    }
}
