{
    "$schema": "../../initia.chain.schema.json",
    "chain_id": "initiation-2",
    "is_testnet": true,
    "chain_name": "initia",
    "chain_type": "initia",
    "apis": {
        "tendermint_rpc_endpoint": {
            "address": "https://rpc-skip.initiation-2.initia.xyz",
            "provider": "Initia Labs",
            "backoff_delay": 1000,
            "basic_auth_required": true
        },
        "lcd_rest_endpoint": {
            "address": "https://rest-skip.initiation-2.initia.xyz",
            "provider": "Initia Labs",
            "backoff_delay": 1000,
            "basic_auth_required": true
        },
        "cosmos_sdk_grpc_endpoint": {
            "address": "skip-grpc.testnet.initia.xyz:443",
            "provider": "Initia Labs",
            "backoff_delay": 0,
            "tls": true,
            "basic_auth_required": true
        }
    }
}