{
    "$schema": "../../initia.chain.schema.json",
    "chain_id": "glados-2.1",
    "is_testnet": true,
    "chain_name": "milkyway",
    "chain_type": "initia",
    "is_initia_l1": false,
    "initia_l1_chain_id": "initiation-2",
    "apis": {
        "tendermint_rpc_endpoint": {
            "address": "https://rpc-skip.rollup-testnet.milkyway.zone",
            "backoff_delay": 1000,
            "basic_auth_required": true,
            "index_for_skip": 0
        },
        "lcd_rest_endpoint": {
            "address": "https://lcd-skip.rollup-testnet.milkyway.zone",
            "backoff_delay": 1000,
            "basic_auth_required": true,
            "index_for_skip": 0
        },
        "cosmos_sdk_grpc_endpoint": {
            "address": "grpc-skip.rollup-testnet.milkyway.zone:443",
            "backoff_delay": 0,
            "tls": true,
            "basic_auth_required": true,
            "index_for_skip": 0
        }
    }
}
